2026-02-24 15:56:12,030: Running clean trial
============================= test session starts ==============================
platform darwin -- Python 3.11.14, pytest-9.0.2, pluggy-1.6.0
rootdir: /Users/mathewostiruwuha/Desktop/CybSec/tatou
configfile: pytest.ini
testpaths: tests
collected 13 items

tests/mutation_testing/test_wm_logic.py .............                    [100%]

============================== 13 passed in 0.01s ==============================
2026-02-24 15:56:12,235: [92m10 mutation targets found in server/src/wm_logic.py AST.[0m
2026-02-24 15:56:12,235: Setting random.seed to: None
2026-02-24 15:56:12,240: Total sample space size: 10
2026-02-24 15:56:12,240: [92mSelecting 10 locations from 10 potentials.[0m
2026-02-24 15:56:12,240: Starting individual mutation trials!
2026-02-24 15:56:12,240: Running serial (single processor) dispatch mode.
2026-02-24 15:56:12,240: Current target location: wm_logic.py, LocIndex(ast_class='If', lineno=10, col_offset=4, op_type='If_Statement', end_lineno=11, end_col_offset=60)
2026-02-24 15:56:12,360: [92mResult: Detected at server/src/wm_logic.py: (10, 4)[0m
2026-02-24 15:56:12,482: [92mResult: Detected at server/src/wm_logic.py: (10, 4)[0m
2026-02-24 15:56:12,482: Current target location: wm_logic.py, LocIndex(ast_class='If', lineno=12, col_offset=4, op_type='If_Statement', end_lineno=13, end_col_offset=61)
2026-02-24 15:56:12,607: [92mResult: Detected at server/src/wm_logic.py: (12, 4)[0m
2026-02-24 15:56:12,728: [92mResult: Detected at server/src/wm_logic.py: (12, 4)[0m
2026-02-24 15:56:12,728: Current target location: wm_logic.py, LocIndex(ast_class='NameConstant', lineno=9, col_offset=41, op_type=None, end_lineno=9, end_col_offset=45)
2026-02-24 15:56:12,841: [91mResult: Survived at server/src/wm_logic.py: (9, 41)[0m
2026-02-24 15:56:12,841: [91mBreak on survival: stopping further mutations at location.[0m
2026-02-24 15:56:12,841: Current target location: wm_logic.py, LocIndex(ast_class='If', lineno=26, col_offset=4, op_type='If_Statement', end_lineno=27, end_col_offset=62)
2026-02-24 15:56:12,961: [92mResult: Detected at server/src/wm_logic.py: (26, 4)[0m
2026-02-24 15:56:13,082: [92mResult: Detected at server/src/wm_logic.py: (26, 4)[0m
2026-02-24 15:56:13,082: Current target location: wm_logic.py, LocIndex(ast_class='If', lineno=19, col_offset=4, op_type='If_Statement', end_lineno=20, end_col_offset=48)
2026-02-24 15:56:13,203: [92mResult: Detected at server/src/wm_logic.py: (19, 4)[0m
2026-02-24 15:56:13,322: [92mResult: Detected at server/src/wm_logic.py: (19, 4)[0m
2026-02-24 15:56:13,322: Current target location: wm_logic.py, LocIndex(ast_class='BoolOp', lineno=17, col_offset=7, op_type=<class 'ast.Or'>, end_lineno=17, end_col_offset=48)
2026-02-24 15:56:13,440: [92mResult: Detected at server/src/wm_logic.py: (17, 7)[0m
2026-02-24 15:56:13,441: Current target location: wm_logic.py, LocIndex(ast_class='If', lineno=17, col_offset=4, op_type='If_Statement', end_lineno=18, end_col_offset=51)
2026-02-24 15:56:13,565: [92mResult: Detected at server/src/wm_logic.py: (17, 4)[0m
2026-02-24 15:56:13,684: [92mResult: Detected at server/src/wm_logic.py: (17, 4)[0m
2026-02-24 15:56:13,684: Current target location: wm_logic.py, LocIndex(ast_class='NameConstant', lineno=16, col_offset=54, op_type=None, end_lineno=16, end_col_offset=58)
2026-02-24 15:56:13,793: [91mResult: Survived at server/src/wm_logic.py: (16, 54)[0m
2026-02-24 15:56:13,793: [91mBreak on survival: stopping further mutations at location.[0m
2026-02-24 15:56:13,793: Current target location: wm_logic.py, LocIndex(ast_class='BoolOp', lineno=19, col_offset=7, op_type=<class 'ast.Or'>, end_lineno=19, end_col_offset=42)
2026-02-24 15:56:13,911: [92mResult: Detected at server/src/wm_logic.py: (19, 7)[0m
2026-02-24 15:56:13,911: Current target location: wm_logic.py, LocIndex(ast_class='CompareIn', lineno=26, col_offset=7, op_type=<class 'ast.NotIn'>, end_lineno=26, end_col_offset=29)
2026-02-24 15:56:14,031: [92mResult: Detected at server/src/wm_logic.py: (26, 7)[0m
2026-02-24 15:56:14,031: Running clean trial
============================= test session starts ==============================
platform darwin -- Python 3.11.14, pytest-9.0.2, pluggy-1.6.0
rootdir: /Users/mathewostiruwuha/Desktop/CybSec/tatou
configfile: pytest.ini
testpaths: tests
collected 13 items

tests/mutation_testing/test_wm_logic.py .............                    [100%]

============================== 13 passed in 0.01s ==============================
2026-02-24 15:56:14,142: CLI Report:

Mutatest diagnostic summary
===========================
 - Source location: /Users/mathewostiruwuha/Desktop/CybSec/tatou/server/src/wm_logic.py
 - Test commands: ['pytest']
 - Mode: s
 - Excluded files: []
 - N locations input: 10
 - Random seed: None

Random sample details
---------------------
 - Total locations mutated: 10
 - Total locations identified: 10
 - Location sample coverage: 100.00 %


Running time details
--------------------
 - Clean trial 1 run time: 0:00:00.203525
 - Clean trial 2 run time: 0:00:00.110447
 - Mutation trials total run time: 0:00:01.797190

2026-02-24 15:56:14,143: Trial Summary Report:

Overall mutation trial summary
==============================
 - DETECTED: 13
 - SURVIVED: 2
 - TOTAL RUNS: 15
 - RUN DATETIME: 2026-02-24 15:56:14.142803

2026-02-24 15:56:14,143: Detected mutations:[92m

DETECTED
--------
 - server/src/wm_logic.py: (l: 10, c: 4) - mutation from If_Statement to If_False
 - server/src/wm_logic.py: (l: 10, c: 4) - mutation from If_Statement to If_True
 - server/src/wm_logic.py: (l: 12, c: 4) - mutation from If_Statement to If_True
 - server/src/wm_logic.py: (l: 12, c: 4) - mutation from If_Statement to If_False
 - server/src/wm_logic.py: (l: 17, c: 4) - mutation from If_Statement to If_True
 - server/src/wm_logic.py: (l: 17, c: 4) - mutation from If_Statement to If_False
 - server/src/wm_logic.py: (l: 17, c: 7) - mutation from <class 'ast.Or'> to <class 'ast.And'>
 - server/src/wm_logic.py: (l: 19, c: 4) - mutation from If_Statement to If_True
 - server/src/wm_logic.py: (l: 19, c: 4) - mutation from If_Statement to If_False
 - server/src/wm_logic.py: (l: 19, c: 7) - mutation from <class 'ast.Or'> to <class 'ast.And'>
 - server/src/wm_logic.py: (l: 26, c: 4) - mutation from If_Statement to If_True
 - server/src/wm_logic.py: (l: 26, c: 4) - mutation from If_Statement to If_False
 - server/src/wm_logic.py: (l: 26, c: 7) - mutation from <class 'ast.NotIn'> to <class 'ast.In'>[0m

2026-02-24 15:56:14,143: Timedout mutations:

2026-02-24 15:56:14,143: Surviving mutations:[91m

SURVIVED
--------
 - server/src/wm_logic.py: (l: 9, c: 41) - mutation from None to True
 - server/src/wm_logic.py: (l: 16, c: 54) - mutation from None to False[0m

